{
  "presetId": "scout-outreach",
  "draftText": "Scout found a qualified opportunity. Evidence includes a recent permit filing and a public expansion note.",
  "sourceArtifact": {
    "schema": "tenra-scout.opportunity-handoff.v1",
    "artifactId": "scout-demo-opportunity",
    "exportedAt": "2026-05-06T17:30:00.000Z"
  },
  "traceId": "proxy-fixture-scout-outreach"
}
